{
  "$schema": "../../schemas/generated.dialog-definition.schema.json",
  "schemaVersion": 1,
  "id": "generated-setup-dialog",
  "adapter": "generated-dialog-adapter",
  "title": "Install workflow packages?",
  "blocks": [
    {"type": "paragraph", "text": "Review the packages and their frozen sources before installation."},
    {"type": "slot", "name": "pending-packages"}
  ],
  "buttons": {"cancel": "Cancel", "confirm": "Install packages"}
}
